Diego,Kiran,85,Just right,yes,"The interaction with Kiran was engaging and enjoyable. We shared a lot of common interests, especially in digital art and the intersection of technology and creativity. Kiran seemed sincere and intelligent, and the conversation flowed naturally without any awkward moments. There was a genuine connection, and I appreciated their openness and enthusiasm. Overall, it was a positive experience, and I would be interested in seeing Kiran again to explore more shared interests.",75,80,80,85,95,90,75,80,70,75,85,90,80,yes,"['Strong shared interest in digital art and technology', 'Natural and engaging conversation flow', 'Lack of deeper emotional topics', 'Potential for creative collaboration', 'Unclear handling of conflict or differences']","Diego and Kiran's conversation was smooth and engaging, with a strong focus on shared interests in digital art and technology. They both displayed enthusiasm and knowledge about the subject, which facilitated a natural flow of dialogue. However, the conversation remained largely within the realm of shared interests, without delving into deeper emotional or personal topics. This suggests a solid foundation for friendship or collaboration but lacks evidence of a deeper emotional connection that might be necessary for a romantic relationship. Additionally, both participants seemed to be on their best behavior, which is typical for early interactions, but it leaves questions about how they might handle disagreements or differences in opinion.",You are attending an art exhibition together on a Saturday evening.,1
Diego,Leila,85,Just right,yes,"The interaction with Leila was engaging and enjoyable. We shared a strong interest in art, particularly in how technology can enhance artistic expression. Leila's sincerity and intelligence were evident throughout the conversation, and there was a genuine connection over shared interests. The conversation flowed naturally, and there were no red flags or deal-breakers. Overall, it was a positive experience, and I would be interested in seeing her again to explore our shared interests further.",75,80,80,85,95,90,75,70,70,75,85,90,80,yes,"['Strong shared interest in art and creativity', 'Natural and engaging conversation flow', 'Lack of emotional depth in the interaction', 'Mutual appreciation for technology in art', 'Potential for further exploration of personal values']","Diego and Leila's interaction at the art exhibition reveals a strong connection based on shared interests in art and technology. Their conversation flows naturally, indicating a comfortable rapport. Both express enthusiasm for art and creativity, which is a significant bonding factor. However, the interaction lacks depth in emotional connection, as the conversation remains largely on the surface level of shared interests without delving into personal or emotional topics. While they both enjoy art and creative expression, there is no indication of how they handle differences or deeper values, which are crucial for long-term compatibility. The conversation is pleasant and engaging, but it remains to be seen if their connection extends beyond shared hobbies.",You are attending an art exhibition together on a Saturday evening.,1
Diego,Leyla,85,Just right,yes,"The interaction with Leyla was engaging and enjoyable. We shared a strong mutual interest in abstract art, which provided a great foundation for our conversation. Leyla seemed sincere and intelligent, and her enthusiasm for art was infectious. There were no red flags, and the conversation flowed naturally, making it a pleasant experience. Overall, there was a genuine connection, and I would be interested in seeing her again to explore our shared interests further.",75,80,80,85,95,90,68,60,70,65,80,85,75,yes,"['Strong shared interest in abstract art', 'Natural conversation flow', 'Lack of emotional depth', 'Absence of red flags', 'Potential for deeper connection with more time']","Diego and Leyla share a mutual interest in art, specifically abstract art, which provides a strong foundation for their interaction. Their conversation flows naturally, with both participants showing genuine interest in each other's thoughts and experiences. However, the dialogue remains largely superficial, focusing primarily on shared interests without delving into deeper personal topics or emotions. While they express enjoyment in each other's company, there is little evidence of a strong emotional connection or vulnerability. The conversation lacks any significant red flags, but also fails to exhibit exceptional depth or chemistry.",You are attending an art exhibition together on a Saturday evening.,1
Diego,Lianhua,78,Just right,yes,"The interaction with Lianhua was engaging and enjoyable. We shared a strong interest in art and its intersection with technology, which made the conversation flow naturally. Lianhua seemed sincere and intelligent, and I appreciated her insights on how art influences her work in data science. There was a genuine connection, and I felt inspired by our discussions. While there were no major red flags, the level of ambition seemed moderate, but overall, the shared interests and fun we had made me interested in seeing her again.",70,75,80,90,85,85,65,70,70,60,80,85,75,yes,"['Shared interest in art and technology', 'Polite and respectful interaction', 'Lack of emotional depth in conversation', 'No evident red flags or concerning behavior', 'Potential for deeper connection with more personal topics']","Diego and Lianhua's interaction at the art exhibition reflects a pleasant and engaging conversation, but lacks depth in emotional connection. They both share a genuine interest in art, which serves as a strong common ground. However, their conversation remains surface-level, focusing primarily on shared interests without delving into more personal or emotionally resonant topics. While they both express enthusiasm for art and its influence on their respective fields, there's little indication of a deeper personal connection or chemistry. Their dialogue is polite and respectful, but lacks the spontaneity and warmth that might suggest a stronger bond.",You are attending an art exhibition together on a Saturday evening.,1
Diego,Lucia,85,Just right,yes,"The interaction with Lucia was highly enjoyable and engaging. We shared a strong mutual interest in art, particularly in digital and interactive forms, which made the conversation flow naturally. Lucia's sincerity and intelligence were evident, and her enthusiasm for art was infectious. There were no red flags, and the conversation length felt just right, allowing us to explore various topics without feeling rushed. Overall, the evening was a delightful experience, and I would be interested in seeing Lucia again to further explore our shared interests.",75,80,88,85,95,90,75,75,70,65,85,90,80,yes,"['Strong shared interest in art, particularly digital and abstract forms.', 'Good conversational flow with mutual respect and interest.', 'Lack of deeper emotional connection or personal sharing.', 'Potential for growth in relationship through shared experiences.', 'Limited exploration of values or future goals.']","Diego and Lucia's interaction at the art exhibition was pleasant and engaging, with a shared enthusiasm for art, particularly digital and abstract forms. They both demonstrated a genuine interest in each other's perspectives and experiences, which facilitated a smooth conversation. However, the interaction lacked depth in emotional connection and personal sharing beyond the art topic. While they clearly share an interest in art, the conversation didn't reveal much about their compatibility in other areas of life, such as values, lifestyle, or future aspirations. This limits the assessment of their overall compatibility.",You are attending an art exhibition together on a Saturday evening.,1
Diego,Marcus,78,Just right,yes,"The interaction with Marcus was enjoyable and engaging. We had a lot in common, especially our interest in hiking and spending time outdoors. Marcus seemed sincere and intelligent, which made the conversation flow naturally. While there wasn't an overwhelming spark, there was definitely potential for a good friendship or more. The conversation length was just right, allowing us to explore mutual interests without feeling rushed. Overall, it was a positive experience, and I'm interested in seeing Marcus again to explore our shared interests further.",65,75,70,80,80,85,58,60,70,80,65,70,75,no,"['Shared interest in outdoor activities like hiking', 'Natural conversation flow without awkward pauses', 'Lack of deep emotional connection', 'Limited discussion on shared values or life goals', 'Focus on recreational activities rather than personal topics']","Diego and Marcus have a pleasant interaction with a shared interest in outdoor activities, which is a positive sign. However, the conversation lacks depth and emotional connection, focusing mainly on surface-level topics like hiking and sports. While they express interest in spending more time together, there is little evidence of a strong emotional bond or shared values beyond recreational activities. Their conversation flows naturally, but it doesn't delve into more meaningful subjects that could indicate a deeper compatibility. Overall, while they enjoy each other's company, the interaction feels more like a friendly acquaintance rather than a potential romantic connection.",You are attending an art exhibition together on a Saturday evening.,1
Diego,Marek,85,Just right,yes,"The interaction with Marek was highly satisfying. We shared a deep appreciation for art, particularly digital and interactive forms, which aligns well with my interests. Marek's sincerity and intelligence were evident throughout our conversation, and the discussion about art's influence on perception was both engaging and thought-provoking. There were no red flags, and the conversation flowed naturally, indicating a good potential for future interactions. Overall, it was an excellent match with a strong connection based on shared interests and values.",75,78,82,88,95,90,72,70,70,65,80,85,75,yes,"['Shared interest in art and technology', 'Natural conversation flow', 'Lack of deeper emotional connection', 'Superficial engagement with personal topics', 'Mutual respect and enthusiasm']","Diego and Marek's conversation at the art exhibition reveals a pleasant interaction with a shared interest in art, particularly digital and interactive forms. Their dialogue flows naturally, with both participants showing enthusiasm and respect for each other's opinions. However, the conversation remains largely superficial, focusing on art without delving into deeper personal topics, which could indicate a lack of strong emotional connection. While they share a common interest in art, there is no evidence of broader shared values or experiences, which might be necessary for a more profound connection. The interaction is polite and engaging, but it lacks the depth and personal vulnerability that often characterizes exceptional compatibility.",You are attending an art exhibition together on a Saturday evening.,1
Diego,Mei Ling,78,Just right,yes,"The interaction with Mei Ling was engaging and enjoyable. We shared a strong interest in art, particularly in how it intersects with technology and personal expression. Mei Ling's sincerity and intelligence were evident, and I appreciated her openness in discussing her thoughts on art. While there wasn't an overwhelming spark, the conversation was pleasant, and I felt a genuine connection. Her interest in abstract art and my focus on interactive art provided a nice balance of shared interests and unique perspectives. Overall, it was a good match, and I would be interested in seeing her again to explore more of our common interests.",65,75,70,85,90,80,58,60,70,65,75,55,80,no,"['Both enjoy art but have different preferences (digital vs. abstract)', 'Good conversational flow, indicating comfort', 'Lack of deeper emotional connection', 'Shared interest in creativity and technology', 'Surface-level interaction without exploring personal topics']","Diego and Mei Ling's conversation at the art exhibition shows a polite and engaging interaction, but lacks depth in emotional connection and shared interests. While they both enjoy art, their specific interests diverge, with Diego focusing on digital and interactive forms and Mei Ling on abstract art and artists like Ai Weiwei. The conversation flows naturally, indicating a good level of comfort between them. However, the interaction remains surface-level, primarily revolving around art without delving into more personal topics. This suggests a moderate level of compatibility, with potential for friendship rather than a deeper romantic connection.",You are attending an art exhibition together on a Saturday evening.,1
Diego,Meilin,85,Just right,yes,"The interaction with Meilin was engaging and enjoyable. We shared a lot of common interests, especially in the realm of digital art and technology, which made the conversation flow naturally. Meilin seemed sincere and intelligent, and I appreciated her openness about her own creative pursuits. There were no red flags, and I felt a genuine connection. Overall, it was a positive experience, and I would be interested in seeing her again to explore more shared interests.",78,80,88,85,92,90,67,60,70,65,80,85,75,yes,"['Shared interest in digital and contemporary art', 'Lack of deeper emotional connection', 'Mutual enthusiasm and engagement', 'Conversation limited to hobby-related topics', 'No significant red flags observed']","Diego and Meilin's interaction at the art exhibition reveals a moderate level of compatibility. They share a mutual interest in contemporary and digital art, which forms the basis of their conversation. Both are engaged and enthusiastic about the exhibition, and they explore their shared passion for art and technology. However, the conversation lacks depth beyond their shared interest. There is no significant exploration of personal values or deeper emotional connection, which could be crucial for a more meaningful relationship. While they both express enjoyment in each other's company, the dialogue remains surface-level, focusing primarily on their common hobby. The absence of any notable red flags is positive, but the interaction could benefit from more personal engagement and exploration of diverse topics.",You are attending an art exhibition together on a Saturday evening.,1
Diego,Mingxia,85,Just right,yes,"The interaction with Mingxia was very enjoyable and engaging. We shared a strong interest in digital art and technology, which made the conversation flow naturally. Mingxia seemed sincere and intelligent, and I appreciated her openness about her own artistic experiences. There were no red flags, and I felt a genuine connection. Overall, it was a positive experience, and I would be interested in seeing her again to explore our shared interests further.",75,80,80,85,90,90,65,65,70,60,80,85,75,yes,"['Shared interest in digital art', 'Smooth conversation flow', 'Lack of emotional depth', 'Polite but superficial interaction', 'Potential for friendship rather than romance']","Diego and Mingxia's interaction at the art exhibition was pleasant and engaging, but not extraordinary. They both share an interest in digital art, which provided a solid foundation for their conversation. However, the dialogue lacked depth and spontaneity, suggesting a polite but somewhat superficial connection. While they both appreciate art and creativity, the conversation did not reveal any profound emotional connection or unique chemistry. Their mutual interest in art is a positive aspect, but it seems more like a shared hobby than a basis for a deeper relationship. The conversation flowed smoothly, but it was largely driven by common interests rather than personal connection.",You are attending an art exhibition together on a Saturday evening.,1
Diego,Minji,78,Just right,yes,"The interaction with Minji was engaging and enjoyable. We shared a mutual appreciation for art and creativity, which made the conversation flow naturally. Minji's experiences in France and her perspective on art added depth to our discussion. I appreciated her sincerity and intelligence, and we seemed to have a good connection. There were no red flags, and I felt a genuine interest in her views and experiences. Overall, it was a positive experience, and I would be interested in seeing her again to explore our shared interests further.",70,75,78,80,82,85,75,60,70,65,85,90,80,yes,"['Strong shared interest in art and culture', 'Natural and engaging conversation flow', 'Intellectual connection through cultural experiences', 'Lack of exploration of deeper personal values', 'Limited discussion on future aspirations or goals']","Diego and Minji's conversation at the art exhibition reveals a strong mutual interest in art and culture, which serves as a solid foundation for their interaction. Both participants engage in a fluid and natural conversation, sharing personal experiences and insights about art from different cultural perspectives. This indicates a good level of intellectual and emotional connection. However, the dialogue lacks depth beyond their shared interest in art, and there's minimal exploration of other personal values or future aspirations. While their conversation is engaging, it remains largely on the surface, with no significant display of vulnerability or deeper personal connection.",You are attending an art exhibition together on a Saturday evening.,1
Diego,Niran,85,Just right,yes,"The interaction with Niran was engaging and enjoyable. We shared a strong interest in the intersection of art and technology, which made the conversation flow naturally. Niran seemed sincere and intelligent, and I appreciated their openness to exploring new ideas. There were no red flags, and I felt a genuine connection. The conversation length was perfect, allowing us to explore shared interests without feeling rushed. Overall, it was a positive experience, and I would be interested in seeing Niran again to further explore our shared interests.",70,75,80,85,95,90,68,60,70,65,80,85,75,yes,"['Shared interest in art and technology', 'Natural conversation flow', 'Lack of emotional depth', 'Focus on surface-level topics', 'Mutual appreciation for interactive art']","Diego and Niran's conversation at the art exhibition reveals a moderate level of compatibility, primarily driven by their shared interest in the intersection of art and technology. Both participants express genuine enthusiasm for the exhibition and engage in a balanced dialogue, indicating a natural flow in their conversation. However, the interaction lacks depth in emotional connection, as the discussion remains largely focused on surface-level topics related to art preferences. While they share similar interests, there is no indication of a deeper personal connection or exploration of values beyond the context of the exhibition. The conversation is pleasant and polite but does not exhibit any profound insights or emotional bonding.",You are attending an art exhibition together on a Saturday evening.,1
Diego,Rafael,78,Just right,yes,"The interaction with Rafael was engaging and enjoyable. We shared a strong connection over art and creativity, which aligns well with my interests. Rafael seemed sincere and intelligent, and our conversation flowed naturally, indicating a good level of compatibility. While there were no major red flags, I felt that Rafael's ambition wasn't as pronounced as other attributes, but this wasn't a significant issue. Overall, the evening was pleasant, and I would be interested in seeing Rafael again to explore our shared interests further.",65,75,70,80,90,85,68,60,70,65,80,85,75,yes,"['Shared interest in art and creativity', 'Polite and respectful interaction', 'Lack of deep emotional connection', 'Surface-level conversation', 'Potential for further exploration']","The interaction between Diego and Rafael is polite and engaging, with both individuals showing a genuine interest in each other's thoughts and preferences. They share a common appreciation for art and creativity, which serves as a strong foundation for their conversation. However, the dialogue lacks depth in terms of personal connection and emotional vulnerability. While they discuss art and creativity, there is little exploration of personal values or deeper emotional topics that could strengthen their bond. The conversation remains on a safe and surface level, which may indicate a lack of deeper compatibility or reluctance to open up further.",You are attending an art exhibition together on a Saturday evening.,1
Diego,Riya,78,Just right,yes,"The interaction with Riya was engaging and enjoyable. We shared a strong interest in art, particularly in interactive and contemporary forms, which provided a solid foundation for our conversation. Riya seemed sincere and intelligent, and I appreciated her openness about her hobbies and interests. While there wasn't an overwhelming spark, the conversation flowed naturally, and I felt a genuine connection over our shared interests. Her ambition seemed moderate, but her sincerity and intelligence made up for it. Overall, it was a positive experience, and I would be interested in seeing her again to explore this connection further.",65,75,70,85,90,80,65,60,70,65,80,85,75,yes,"['Shared interest in art and creativity', 'Natural conversational flow', 'Lack of deep emotional connection', 'Superficial discussion topics', 'Potential for further exploration over coffee']","Diego and Riya's conversation at the art exhibition reveals a moderate level of compatibility. They both share a genuine interest in art, particularly in interactive and contemporary forms, which forms a solid foundation for their interaction. Their discussion flows naturally, indicating a decent conversational rapport. However, the conversation lacks depth in terms of personal emotional connection, as it remains largely focused on art without delving into more personal topics. While they both express enthusiasm and curiosity about each other's interests, there is no strong evidence of a deeper emotional bond or shared life values beyond their mutual appreciation for art. The conversation is pleasant but somewhat superficial, with no significant red flags or concerning behavior. Overall, they seem to enjoy each other's company, but whether this can translate into a meaningful relationship remains uncertain.",You are attending an art exhibition together on a Saturday evening.,1
Diego,Sakura,85,Just right,yes,"The interaction with Sakura was very engaging and enjoyable. We shared a strong interest in art and technology, which made the conversation flow naturally. Sakura seemed sincere and intelligent, and I appreciated her openness to exploring digital art. There were no red flags, and the potential for collaboration in our shared interests is exciting. Overall, it was a positive experience, and I would be interested in seeing her again.",80,80,88,85,95,90,75,75,70,65,85,90,80,yes,"['Strong shared interest in art and technology', 'Natural conversation flow', 'Willingness to collaborate on future projects', 'Lack of exploration of other personal aspects', 'Potential for deeper connection if explored further']","Diego and Sakura's conversation at the art exhibition reveals a strong mutual interest in art, particularly in the intersection of technology and creativity. They both express enthusiasm for digital and interactive art, which creates a solid foundation for their interaction. The conversation flows naturally, with both parties actively engaging and sharing personal experiences related to art. However, the interaction lacks depth beyond their shared interest in art, and there's little exploration of other aspects of their personalities or lives. While they express a willingness to collaborate on future projects, which is a positive sign, the conversation remains somewhat superficial, focusing mainly on their common interest.",You are attending an art exhibition together on a Saturday evening.,1
Diego,Sofia,85,Just right,yes,"The interaction with Sofia was engaging and enjoyable. We shared a strong interest in art and creativity, which made the conversation flow naturally. Sofia seemed sincere and intelligent, and I appreciated her insights into abstract art and digital creativity. There was a genuine connection, and I felt that we could explore more shared interests in the future. Overall, it was a positive experience with potential for further interactions.",75,80,80,85,90,90,72,70,70,65,80,85,75,yes,"['Shared interest in art and technology', 'Natural conversation flow', 'Lack of emotional depth', 'Intellectual connection', 'Potential for deeper exploration']","Diego and Sofia's interaction at the art exhibition reveals a shared interest in art and technology, which forms a solid foundation for their conversation. Their dialogue flows naturally, suggesting a comfortable rapport. Both express a genuine enthusiasm for creative expression, particularly through abstract and digital art. However, while they share interests, the conversation lacks deeper emotional connection and personal revelations, which are crucial for a stronger bond. Their discussion remains largely intellectual and focused on shared interests without venturing into more personal or vulnerable topics. This could indicate a potential lack of emotional depth in their connection.",You are attending an art exhibition together on a Saturday evening.,1
