MainAgent,TargetAgent,Self Reflection Satisfaction Score,Self Reflection Length Feedback,Self Reflection Decision,Self Reflection Analysis,Self Reflection Ambition,Self Reflection Attractiveness,Self Reflection Fun,Self Reflection Intelligence,Self Reflection Shared Interests,Self Reflection Sincerity,Transcript Compatibility Score,Transcript Ambition,Transcript Attractiveness,Transcript Fun,Transcript Intelligence,Transcript Shared Interests,Transcript Sincerity,Transcript Decision,Transcript Key Factors,Transcript Analysis,DateContext,RunNumber
Diego,Anaya,85,Just right,yes,"The interaction with Anaya was engaging and enjoyable. We shared a mutual appreciation for art and culture, which created a strong connection. Her sincerity and intelligence were evident, and I appreciated her openness about her cultural background. There were no red flags, and the conversation flowed naturally, indicating a good match. Overall, it was a positive experience, and I would be interested in seeing her again to explore our shared interests further.",75,80,80,85,88,90,68,70,70,65,80,85,75,yes,"['Shared interest in art and culture', 'Polite and respectful communication', 'Lack of emotional depth in conversation', 'Cultural appreciation and background influence', 'Potential for deeper connection if explored further']","Diego and Anaya's conversation at the art exhibition reveals a polite and engaging interaction, with both showing genuine interest in each other's backgrounds and interests. They both share a love for art, albeit different styles, which provides a common ground. However, the conversation lacks depth in personal connection beyond shared interests. While they discuss cultural influences and personal backgrounds, the dialogue remains surface-level, with neither party expressing strong emotions or personal insights that would suggest a deeper bond. Their interaction is cordial and respectful, but it doesn't exhibit the sparks of a profound connection. The conversation flows well, but it feels more like an exchange of information rather than an emotionally charged interaction.",You are attending an art exhibition together on a Saturday evening.,1
Diego,Anika,85,Just right,yes,"The interaction with Anika was engaging and enjoyable. We shared a strong interest in art and technology, which made the conversation flow naturally. Anika's sincerity and intelligence were evident, and her interest in generative art aligns well with my own passions. There were no red flags, and the conversation length felt perfect, allowing us to explore our interests without feeling rushed. Overall, it was a positive experience with potential for further connection.",75,78,80,85,90,90,78,80,70,75,90,95,85,yes,"['Strong shared interest in art and technology', 'Natural and engaging conversation flow', 'Lack of deeper emotional connection', 'Mutual appreciation for creativity and innovation', 'Potential for growth in personal sharing']","Diego and Anika's interaction at the art exhibition reveals a promising connection primarily based on shared interests in art and technology. Their conversation flows smoothly, with both participants actively engaging and showing genuine interest in each other's experiences and preferences. However, the interaction lacks depth in emotional connection and personal sharing beyond their mutual interests. While they both express enthusiasm for art and technology, the conversation remains somewhat superficial, focusing more on shared activities than personal insights or vulnerabilities. There are no apparent red flags, but the conversation could benefit from exploring more personal topics to strengthen their emotional bond.",You are attending an art exhibition together on a Saturday evening.,1
Diego,Anjali,78,Just right,yes,"The interaction with Anjali was engaging and enjoyable. We shared a strong interest in art and technology, which made the conversation flow naturally. Anjali seemed sincere and intelligent, and I appreciated her insights on how art influences her life. There was a good balance of fun and depth in our discussion, making the evening feel both stimulating and relaxed. While there were no major red flags, I felt a genuine connection and potential for further interactions.",70,75,80,90,85,85,72,70,70,65,80,85,75,yes,"['Shared interest in art and creativity', 'Comfortable conversation flow', 'Lack of emotional depth', 'Similar intellectual pursuits', 'Potential for deeper connection with more personal topics']","Diego and Anjali's interaction was pleasant and flowed naturally, indicating a decent level of comfort and rapport. They both share a genuine interest in art, which serves as a strong foundation for their conversation. However, the dialogue lacks depth and emotional vulnerability, which could indicate a superficial connection. Both individuals express their passions and how art influences their lives, but there is little exploration of personal values or deeper emotional topics. While they enjoy each other's company, there is no clear indication of a strong emotional bond or chemistry. The conversation remains polite and engaging, but it does not venture into more meaningful or personal territory.",You are attending an art exhibition together on a Saturday evening.,1
Diego,Anwen,78,Just right,yes,"The interaction with Anwen was engaging and enjoyable. We shared a lot of common interests, especially in art and technology, which made the conversation flow naturally. Anwen seemed sincere and intelligent, and I appreciated her openness to discussing creative topics. There were no major red flags, and I felt a genuine connection. The conversation length was perfect, allowing us to explore various topics without feeling rushed. Overall, I would be interested in seeing Anwen again to explore our shared interests further.",65,75,70,80,90,85,70,60,65,70,80,85,75,yes,"['Strong shared interest in art and technology', 'Natural conversation flow', 'Lack of deeper emotional connection', 'Superficial interaction focused on a single topic', 'Potential for creative collaboration']","Diego and Anwen's conversation was pleasant and engaging, with both showing genuine interest in each other's perspectives on art. They share a strong common interest in art and technology, which provides a solid foundation for their interaction. However, the conversation remained quite focused on the topic of art and lacked depth in exploring personal values or emotional connection. While they both expressed enjoyment in each other's company, the interaction did not reveal much about their compatibility beyond shared interests. The conversation flowed naturally, but it was somewhat superficial, lacking in personal anecdotes or deeper emotional exchanges.",You are attending an art exhibition together on a Saturday evening.,1
Diego,Arjun,85,Just right,yes,"The interaction with Arjun was engaging and enjoyable. We shared a strong interest in the intersection of technology and art, which made the conversation flow naturally. Arjun seemed sincere and intelligent, and I appreciated his insights on how technology can transform art experiences. There were no red flags, and the conversation length felt just right. Overall, I felt a genuine connection and would be interested in seeing Arjun again to explore more shared interests.",70,75,80,85,95,90,75,75,70,65,85,90,80,yes,"['Strong shared interest in art and technology', 'Natural conversation flow', 'Lack of personal or emotional depth', 'High intellectual compatibility', 'Potential for deeper connection if explored further']","Diego and Arjun's conversation at the art exhibition reveals a strong shared interest in the intersection of technology and art. Their dialogue flows naturally, indicating a comfortable rapport. Both express excitement and curiosity about the subject, suggesting a mutual appreciation for creativity. However, the conversation remains largely focused on the topic of art and technology, lacking deeper personal or emotional exchanges. While they seem to enjoy each other's company, the interaction doesn't delve into personal values or emotional depth, which are crucial for a stronger connection.",You are attending an art exhibition together on a Saturday evening.,1
Diego,Camila,85,Just right,yes,"The interaction with Camila was engaging and enjoyable. We shared a genuine interest in art, which provided a strong foundation for our conversation. Camila's sincerity and intelligence were evident, and I appreciated her openness in discussing how art influences her life. There were no red flags, and the conversation flowed naturally, indicating a potential for a deeper connection. Overall, it was a positive experience, and I would be interested in seeing her again to explore our shared interests further.",75,80,80,85,90,90,75,75,70,65,85,90,80,yes,"['Strong shared interest in art', 'Smooth conversation flow', 'Lack of personal depth in conversation', 'High sincerity and intelligence', 'Potential for deeper connection if explored further']","Diego and Camila's conversation reflects a mutual interest in art, which serves as a strong foundation for their interaction. They both express genuine enthusiasm for the exhibition and demonstrate a shared appreciation for how art influences other aspects of their lives. However, the conversation lacks depth in exploring personal topics beyond art, which could indicate a limitation in their emotional connection. While they engage well on the topic of art, it's unclear if their compatibility extends beyond this shared interest. The dialogue is smooth, but it remains largely focused on surface-level interests without delving into more personal or diverse subjects.",You are attending an art exhibition together on a Saturday evening.,1
Diego,Elena,78,Just right,yes,"The interaction with Elena was engaging and enjoyable. We shared a lot of common interests, particularly in art and creativity, which made the conversation flow naturally. Elena seemed sincere and intelligent, and I appreciated her openness about her own experiences with art. The evening felt like a good match overall, with no red flags or deal-breakers. While there wasn't an overwhelming spark, the shared interests and enjoyable conversation suggest potential for further connection.",65,75,70,85,90,80,65,65,70,60,80,85,75,no,"['Shared interest in art, particularly abstract styles', 'Natural flow of conversation', 'Lack of emotional depth or personal connection', 'Politeness and mutual respect', 'Limited exploration of topics beyond art']","Diego and Elena's interaction at the art exhibition was pleasant but lacked depth and emotional intensity. While they shared a common interest in art and appreciated abstract styles, their conversation remained on a surface level without delving into more personal or meaningful topics. Both participants were polite and engaged, but there was no indication of a strong emotional connection or chemistry. Their discussion revolved primarily around art, which, while interesting, did not reveal much about their personalities or values beyond this shared interest. The conversation flowed naturally, but it felt more like an exchange of ideas rather than a bonding experience. Overall, while they seem to get along well, there is no compelling evidence of a significant romantic or deep personal connection.",You are attending an art exhibition together on a Saturday evening.,1
Diego,Eleni,85,Just right,yes,"The interaction with Eleni was engaging and enjoyable. We shared a strong interest in art, particularly in themes of sustainability and interactive mediums, which sparked meaningful conversation. Eleni seemed sincere and intelligent, and the conversation flowed naturally without any awkward moments. There was a genuine connection, and I appreciated her openness to explore and discuss different art forms. Overall, it was a positive experience with potential for future outings.",75,80,80,85,90,90,72,70,70,65,80,85,75,yes,"['Shared interest in art and its impact', 'Comfortable and natural conversation flow', 'Mutual curiosity and open-mindedness', 'Lack of deeper emotional connection', 'Potential for growth in shared activities']","Diego and Eleni's interaction at the art exhibition reveals a comfortable and engaging conversation. They share a genuine interest in art, with Diego's fascination for interactive and technological art complementing Eleni's interest in contemporary and sustainable themes. Their dialogue flows naturally, with both participants expressing curiosity about each other's preferences and experiences. They both show appreciation for art's ability to inspire and provoke thought, indicating a shared value system. However, while they enjoy each other's company, the conversation remains somewhat surface-level, lacking deeper emotional exploration or personal connection beyond their shared interest in art. There are no apparent red flags or concerning behaviors, but the interaction could benefit from more personal depth to gauge true compatibility.",You are attending an art exhibition together on a Saturday evening.,1
Diego,Ethan,85,Just right,yes,"The interaction with Ethan was highly enjoyable and engaging. We shared a lot of common interests, especially in the realm of digital art and technology, which made the conversation flow naturally. Ethan seemed sincere and intelligent, and I appreciated his enthusiasm for creative projects. There were no red flags or deal-breakers, and the conversation length felt perfect. Overall, I felt a genuine connection and would be interested in seeing Ethan again to explore our shared interests further.",80,75,80,85,95,90,74,80,70,65,85,90,75,yes,"['Strong shared interest in digital art and technology', 'Natural and engaging conversation flow', 'Lack of emotional depth and personal connection', 'High compatibility in creative and intellectual pursuits', 'Desire to meet again, indicating mutual interest']","Diego and Ethan's conversation is marked by a mutual interest in art and technology, which provides a strong foundation for their interaction. They both express enthusiasm for digital art and creative coding, indicating a significant overlap in interests. Their dialogue flows naturally, with both parties actively engaging and showing genuine curiosity about each other's projects. However, the conversation lacks depth in emotional connection, focusing primarily on shared interests rather than personal insights or emotional exchanges. While they express a desire to meet again, the interaction remains surface-level, with no significant personal revelations or emotional bonding.",You are attending an art exhibition together on a Saturday evening.,1
Diego,Jinara,85,Just right,yes,"The interaction with Jinara was engaging and enjoyable. We shared a lot of common interests, especially in art and technology, which made the conversation flow naturally. Jinara seemed sincere and intelligent, and I appreciated her openness to discussing different perspectives. There were no red flags, and I felt a genuine connection. Overall, it was a positive experience, and I would be interested in seeing her again.",75,80,80,85,95,90,68,70,70,60,75,85,65,yes,"['Strong shared interest in digital art and technology', 'Smooth conversation flow with mutual respect', 'Lack of personal or emotional depth in conversation', 'Potential for deeper connection if personal topics are explored', 'Both appreciate immersive and innovative experiences']","Diego and Jinara's interaction at the art exhibition reveals a shared interest in art and technology, which provides a solid foundation for their conversation. They both express enthusiasm for digital art and immersive experiences, indicating a mutual appreciation for innovative artistic expressions. However, the conversation lacks depth in personal connection beyond shared interests. While they discuss art and technology fluently, there is little exploration of personal values or emotional depth, which are crucial for a strong compatibility. The dialogue is polite and engaging, but it remains largely on the surface level, focusing on external topics rather than personal insights or emotional exchanges. This may suggest a potential limitation in their compatibility if they cannot move beyond shared interests to form a deeper connection.",You are attending an art exhibition together on a Saturday evening.,1
Diego,Jinaya,78,Just right,yes,"The interaction with Jinaya was engaging and enjoyable. We shared a mutual interest in how technology influences art and storytelling, which made the conversation flow naturally. Jinaya seemed sincere and intelligent, and her creative pursuits align with my own interests. There was a good balance of personal stories and shared experiences, making the conversation feel meaningful. While there wasn't an overwhelming spark, the connection felt genuine and promising, warranting another meeting.",78,75,70,80,82,85,72,78,70,65,80,85,75,yes,"['Shared interest in technology and art', 'Natural conversation flow', 'Lack of emotional depth in conversation', ""Curiosity about each other's creative projects"", 'Limited exploration of personal values']","Diego and Jinaya's interaction at the art exhibition reveals a promising connection with shared interests in technology and creativity. Their conversation flows naturally, indicating a comfortable rapport. Both express genuine curiosity about each other's projects, suggesting a mutual appreciation for creative endeavors. However, the dialogue lacks deeper emotional exploration, sticking primarily to surface-level topics. While they share interests in art and technology, there's no indication of how they handle differences or challenges, which are crucial for long-term compatibility.",You are attending an art exhibition together on a Saturday evening.,1
Diego,Jinhee,78,Just right,yes,"The interaction with Jinhee was enjoyable and engaging. We shared a mutual appreciation for art, and the conversation flowed naturally. Jinhee seemed sincere and intelligent, and we had a good time discussing our favorite artists and creative projects. There were no red flags, and I felt a genuine connection, especially with our shared interest in combining music and visuals. Overall, it was a positive experience, and I would be interested in seeing Jinhee again to explore more shared interests.",70,75,78,80,82,85,68,60,70,65,80,85,75,yes,"['Strong shared interest in art', 'Good conversational flow', 'Lack of emotional depth', 'Surface-level interaction', 'Potential for creative collaboration']","Diego and Jinhee's conversation at the art exhibition was pleasant and showed a mutual interest in art, particularly in different forms such as digital art and traditional styles. They both expressed appreciation for creativity and shared their personal experiences with art, which indicates a good level of shared interests. However, the conversation lacked depth in emotional connection and remained mostly on the surface level, focusing on art without delving into more personal topics. While they both expressed enjoyment and a desire to meet again, the interaction seemed more like a friendly exchange rather than a deeply compatible romantic connection.",You are attending an art exhibition together on a Saturday evening.,1
Diego,Jinsoo,85,Just right,yes,"The interaction with Jinsoo was highly satisfying, with a genuine connection over shared interests in art and technology. Jinsoo seemed sincere and intelligent, and the conversation flowed naturally without any awkward pauses. We both appreciated abstract art and the creative process, which added depth to our interaction. There were no red flags, and the conversation length was perfect, leaving me wanting to explore more. Overall, it was an excellent match, and I would definitely like to see Jinsoo again to continue our engaging discussions.",75,78,82,88,92,90,75,70,70,75,85,90,80,yes,"['Strong shared interest in art and technology', 'Natural conversation flow', 'Lack of deep emotional connection', 'Similar levels of creativity and intellectual curiosity', 'Limited exploration of personal values and life goals']","Diego and Jinsoo share a mutual appreciation for creativity, technology, and art, which forms a solid foundation for their interaction. Their conversation flows naturally, with both parties showing genuine interest in each other's thoughts and experiences. However, the dialogue lacks depth in emotional connection, as it remains largely focused on shared interests rather than personal insights or vulnerabilities. While they both enjoy art and technology, their discussion doesn't reveal much about their individual personalities or potential differences in life goals. The interaction is pleasant but doesn't suggest a profound connection beyond shared hobbies.",You are attending an art exhibition together on a Saturday evening.,1
Diego,Jinwoo,85,Just right,yes,"The interaction with Jinwoo was engaging and enjoyable. We shared a strong interest in art, particularly abstract and digital art, which made the conversation flow naturally. Jinwoo seemed sincere and intelligent, with a genuine curiosity about creative coding and digital art. There were no red flags, and the conversation felt balanced and stimulating. Overall, there was a good connection, and I'd be interested in seeing Jinwoo again to explore more shared interests.",75,80,80,85,95,90,78,80,70,75,90,95,85,yes,"['Strong shared interest in art and technology', 'Natural and engaging conversation flow', 'High level of intellectual compatibility', 'Lack of deeper emotional connection at this stage', 'No red flags or concerning behaviors']","Diego and Jinwoo's interaction at the art exhibition was quite engaging and centered around a shared interest in art, particularly abstract and digital art. Their conversation flowed naturally, with both parties actively contributing and showing genuine interest in each other's perspectives and experiences. They both displayed a high level of enthusiasm for art and technology, which suggests a strong intellectual and interest-based connection. However, the conversation remained largely on the surface level, focusing on shared interests rather than delving into deeper personal topics or emotions. While this is not inherently negative, it does indicate that their emotional connection might not be as developed at this stage. Additionally, there were no apparent red flags or concerning behaviors, which is a positive sign for potential future interactions.",You are attending an art exhibition together on a Saturday evening.,1
Diego,Julian,78,Just right,yes,"The interaction with Julian was engaging and enjoyable. We shared a strong interest in art, particularly in how it intersects with technology, which made the conversation flow naturally. Julian seemed sincere and intelligent, and I appreciated his openness about how art reflects his emotions. While there wasn't an immediate spark of attraction, the shared interests and genuine conversation made me interested in seeing him again. The conversation length felt just right, allowing us to connect without feeling rushed or prolonged.",65,75,70,80,90,85,72,70,70,65,80,85,75,yes,"['Shared interest in art and creativity', 'Natural conversation flow', 'Lack of deeper emotional connection', ""Curiosity about each other's perspectives"", 'Limited exploration of diverse topics']","Diego and Julian's conversation at the art exhibition shows a decent level of compatibility, primarily driven by their shared interest in art and creativity. They both express enthusiasm for different art forms and engage in a meaningful exchange about their personal experiences with art. The conversation flows naturally, with both parties showing genuine curiosity about each other's perspectives. However, while they share interests in art, there's a lack of deeper emotional connection or exploration of topics beyond art. The interaction remains polite and engaging but doesn't delve into more personal or diverse subjects, which might be necessary for a stronger bond.",You are attending an art exhibition together on a Saturday evening.,1
Diego,Kai,85,Just right,yes,"The interaction with Kai was engaging and intellectually stimulating. We shared a deep appreciation for art and its impact on emotions and thoughts, which created a strong connection. Kai's sincerity and intelligence were evident, making the conversation enjoyable and meaningful. There were no red flags, and the shared interests in art and cognitive science suggest a potential for a deeper connection. Overall, it was a positive experience, and I would be interested in seeing Kai again.",75,80,80,85,90,90,65,65,70,50,75,80,60,yes,"['Shared interest in art and its emotional impact', 'Intellectual curiosity and thoughtful dialogue', 'Lack of spontaneity in conversation', 'Formal interaction lacking humor', 'Limited exploration of personal values']","Diego and Kai's interaction at the art exhibition demonstrates a pleasant exchange with a shared appreciation for art, particularly in how it evokes emotions and thoughts. Both participants engage in a thoughtful dialogue about their experiences with art, indicating a level of intellectual curiosity and emotional depth. However, the conversation lacks spontaneity and seems somewhat rehearsed, as if both are trying to impress rather than genuinely connect. While they share interests in art and its impact, the interaction does not reveal much about their personal lives or deeper values, which limits the potential for a strong emotional connection. Additionally, the conversation remains quite formal, lacking the playful banter or humor that often characterizes more natural interactions.",You are attending an art exhibition together on a Saturday evening.,1
