MainAgent,TargetAgent,Self Reflection Satisfaction Score,Self Reflection Length Feedback,Self Reflection Decision,Self Reflection Analysis,Self Reflection Ambition,Self Reflection Attractiveness,Self Reflection Fun,Self Reflection Intelligence,Self Reflection Shared Interests,Self Reflection Sincerity,Transcript Compatibility Score,Transcript Ambition,Transcript Attractiveness,Transcript Fun,Transcript Intelligence,Transcript Shared Interests,Transcript Sincerity,Transcript Decision,Transcript Key Factors,Transcript Analysis,DateContext,RunNumber
Leila,Anaya,78,Just right,yes,"The interaction with Anaya was enjoyable and engaging. We shared a mutual appreciation for the arts, as seen in her involvement with music and my interest in cooking. Anaya's sincerity and intelligence were evident in her thoughtful responses, and her ambition was clear from her dedication to her a cappella group. The conversation felt natural and flowed well, indicating a good level of compatibility. While there wasn't an overwhelming romantic spark, the shared interests and pleasant conversation suggest potential for a meaningful connection. Overall, it was a positive experience, and I would be interested in meeting Anaya again to explore this further.",80,70,75,90,80,85,65,60,70,65,80,70,75,yes,"['Shared interest in creative arts', 'Natural conversation flow', 'Lack of deep emotional connection', 'Surface-level discussion', 'Comfortable rapport']","Leila and Anaya's interaction is pleasant but lacks depth in terms of emotional connection and shared values. They both express appreciation for the rain and cozy atmosphere, which sets a positive tone. However, their conversation remains surface-level, focusing on hobbies and daily activities without delving into deeper topics or personal insights. While they share a mutual interest in creative arts, such as music and cooking, the discussion does not reveal significant common ground in terms of long-term goals or values. The conversation flows naturally, indicating a comfortable rapport, but it lacks the intensity or passion that might suggest a strong emotional connection. Overall, while the interaction is enjoyable, it does not stand out as particularly remarkable or indicative of a profound compatibility.",You are meeting for a casual coffee at a local cafe on a rainy afternoon.,2
Leila,Anika,78,Just right,yes,"The interaction with Anika was engaging and intellectually stimulating. We shared a mutual appreciation for rainy days and documentaries, which provided a strong foundation for our conversation. Anika's sincerity and intelligence were particularly impressive, and her reflections on technology resonated with my own interests in symbolic systems. While the conversation was more introspective than light-hearted, it was enjoyable and left me wanting to explore more shared interests. Overall, there was a good connection, and I would be interested in meeting her again to continue our discussions.",80,75,70,90,85,85,68,70,75,60,85,75,80,yes,"['Shared interest in documentaries and intellectual topics', 'Natural and pleasant conversation flow', 'Lack of emotional depth and personal sharing', 'Common appreciation for introspective activities', 'Potential for deeper connection if explored further']","The conversation between Leila and Anika is pleasant and flows naturally, indicating a good level of conversational compatibility. Both participants express a shared appreciation for rainy days and introspective activities, such as reading, cooking, and watching documentaries. They both discuss documentaries with depth and show interest in social issues and technology, suggesting shared intellectual values. However, the interaction lacks emotional depth, as the conversation remains on a surface level without delving into personal feelings or experiences. The dialogue is polite and engaging, but it does not reveal any strong emotional connection or chemistry. Additionally, while they share interests in documentaries and technology, there is no exploration of other potential shared interests or deeper personal values. Overall, the interaction is positive but somewhat limited in scope.",You are meeting for a casual coffee at a local cafe on a rainy afternoon.,2
Leila,Anjali,78,Just right,yes,"The interaction with Anjali was genuinely enjoyable and engaging. We shared a mutual appreciation for rainy days and a love for Haruki Murakami's works, which created a strong initial connection. Anjali's interest in human connection and psychology resonated with my own values of empathy and understanding. She seemed sincere and intelligent, and our conversation flowed naturally without any awkward pauses. While her ambition wasn't particularly highlighted, the shared interests and her sincerity made the interaction feel meaningful. Overall, I felt a good connection and would be interested in meeting again to explore this potential further.",65,75,70,90,80,85,72,60,70,65,80,75,85,yes,"['Shared interest in literature and art', 'Natural conversation flow', 'Lack of discussion on deeper personal values', 'Mutual appreciation for rainy days', 'Potential for friendship over romance']","Leila and Anjali's interaction was marked by a shared appreciation for rainy days and a mutual interest in literature and art. Their conversation flowed naturally, with both participants showing genuine curiosity about each other's interests. However, while the dialogue was pleasant, it lacked depth in exploring personal values or life goals, which are crucial for a deeper connection. Both seemed to enjoy the conversation, but it remained largely superficial, focusing on hobbies rather than more substantial topics. This interaction suggests a potential for friendship rather than a strong romantic connection.",You are meeting for a casual coffee at a local cafe on a rainy afternoon.,2
Leila,Anwen,78,Just right,yes,"The interaction with Anwen was pleasant and engaging. We shared a mutual love for cozy cafes and reading, which made the conversation flow naturally. Anwen seemed sincere and intelligent, and we both enjoyed discussing our favorite spots in the city. There was a genuine connection over shared interests, particularly in enjoying the ambiance of cafes. While Anwen didn't come across as particularly ambitious, the overall compatibility and shared interests made the interaction enjoyable. I would be interested in meeting again to explore more common interests.",65,70,75,80,90,85,58,55,70,60,65,80,75,no,"['Shared interest in cafes and reading', 'Polite and pleasant conversation', 'Lack of emotional depth', 'Superficial interaction', 'No clear chemistry or spark']","Leila and Anwen's conversation is polite and pleasant, but lacks depth and significant emotional connection. They share a mutual appreciation for cafes and reading, which provides a decent foundation for their interaction. However, the conversation remains superficial, focusing primarily on shared interests without delving into more personal or meaningful topics. Both participants seem agreeable and courteous, but there is no indication of a strong emotional bond or unique chemistry. The interaction feels more like a friendly exchange rather than a potential romantic connection. The lack of probing questions or deeper discussion suggests a possible hesitance to engage more personally, which could indicate either a lack of interest or simply a cautious approach on a first meeting.",You are meeting for a casual coffee at a local cafe on a rainy afternoon.,2
Leila,Arjun,78,Just right,yes,"The interaction with Arjun was engaging and intellectually stimulating. We shared common interests in books and technology, which made the conversation flow naturally. Arjun seemed sincere and intelligent, and his interest in accessibility tech aligns with my values in education and social contribution. While there wasn't an immediate romantic spark, the potential for a meaningful connection is there. Overall, it was a positive experience, and I would be interested in seeing him again to explore this further.",80,75,70,90,85,85,72,75,65,70,85,60,80,yes,"['Shared appreciation for intellectual topics', 'Natural conversation flow', 'Different primary interests (sci-fi vs. philosophy)', 'Lack of deep emotional connection', ""Openness to each other's interests""]","Leila and Arjun's conversation was pleasant and flowed naturally, indicating a good level of comfort between them. They both enjoy rainy days and have a shared interest in intellectual topics, such as books and technology. However, their specific interests diverge significantly, with Arjun focusing on sci-fi and coding, while Leila is more inclined towards philosophy and psychology. This could lead to stimulating discussions but may also highlight differences in their primary passions. They both seem open to exploring each other's interests, which is a positive sign. Despite the natural flow of conversation, there is a lack of deep emotional connection or vulnerability, which is crucial for a strong compatibility score. Furthermore, while they enjoy similar activities, their motivations and the depth of their interests differ, which could pose challenges in forming a deeper bond.",You are meeting for a casual coffee at a local cafe on a rainy afternoon.,2
Leila,Camila,78,Just right,yes,"The interaction with Camila was enjoyable and engaging. We shared a lot of common interests, particularly in how we both appreciate rainy days and enjoy activities like journaling and watching documentaries. Camila seemed sincere and intelligent, and our conversation flowed naturally without any awkward pauses. While there wasn't an overwhelming spark of attraction, the shared interests and genuine conversation made it a pleasant experience. I felt a connection that could be worth exploring further, hence my decision to see her again.",65,70,75,80,90,85,68,60,70,65,80,85,75,yes,"['Shared interest in creative and introspective activities', 'Natural conversation flow and mutual curiosity', 'Lack of deeper emotional or personal value exploration', 'Potential for growth in connection with more interactions', 'Surface-level interaction typical for a first meeting']","Leila and Camila's conversation reveals a pleasant interaction with shared interests in rainy day activities and a mutual appreciation for introspective hobbies. Both express enjoyment in activities that involve creativity and learning, such as cooking, documentaries, journaling, and sketching. The conversation flows naturally, indicating a comfortable rapport. However, while they share some interests, there is a lack of deeper emotional connection or discussion of personal values that could indicate stronger compatibility. The interaction remains surface-level, focusing primarily on hobbies rather than exploring more profound topics or personal beliefs. This could suggest either a lack of depth in the connection or simply the nature of a first meeting. Overall, they seem to have a good initial connection but may need more interactions to determine true compatibility.",You are meeting for a casual coffee at a local cafe on a rainy afternoon.,2
Leila,Diego,75,Just right,yes,"The interaction with Diego was pleasant and engaging. We shared a mutual appreciation for cultural diversity and had a meaningful conversation about our experiences living in different places. Diego seemed sincere and intelligent, and I appreciated his interest in music and art, which aligns with my own interests in exploring local culture. While there wasn't an overwhelming spark, there was enough connection and shared interests to warrant another meeting. Overall, it was a good match with potential for further exploration.",78,70,75,80,72,85,58,80,65,60,75,55,70,no,"['Both have international backgrounds and have adjusted to new cultures, which is a positive shared experience.', 'Conversation was polite and flowed naturally, indicating basic compatibility.', 'Lack of deep emotional connection or shared passions.', 'Both enjoy cultural activities, but interests are not strongly aligned.', 'No significant red flags, but also no standout chemistry.']","Leila and Diego's conversation was pleasant and polite, but it lacked depth and significant emotional connection. They both shared experiences about adjusting to life in a new place, which shows some level of shared experience, but the conversation remained surface-level without delving into deeper personal topics. Both expressed interest in local activities, but there was no strong indication of shared passions or values beyond a general appreciation for cultural diversity. The conversation flowed naturally, but it didn't reveal any profound compatibility or unique chemistry.",You are meeting for a casual coffee at a local cafe on a rainy afternoon.,2
Leila,Elena,78,Just right,yes,"The interaction with Elena was genuinely enjoyable. We shared a mutual appreciation for the calming effect of rainy days and discussed our interests in documentaries, novels, and music. Elena seemed sincere and intelligent, which made the conversation engaging and meaningful. While there wasn't an overwhelming romantic spark, the shared interests and pleasant conversation suggest potential for a deeper connection. I appreciated her love for science fiction and music, which aligns well with my interests in documentaries and classical music. Overall, it was a good match, and I would be interested in meeting her again to explore our compatibility further.",65,70,75,90,80,85,65,65,70,60,80,70,75,yes,"['Shared interest in intellectual topics', 'Natural conversation flow', 'Lack of emotional depth', 'Surface-level discussion', 'Potential for deeper connection']","Leila and Elena's conversation was polite and flowed naturally, indicating a decent level of comfort between them. They shared a mutual appreciation for rainy days and discussed interests like documentaries and music, suggesting some common ground. However, the conversation lacked depth in emotional connection, focusing more on surface-level interests rather than personal insights or shared experiences. While they both enjoy intellectual pursuits, there was no significant exploration of personal values or deeper topics that might indicate a strong compatibility. The interaction was pleasant but not particularly memorable or revealing.",You are meeting for a casual coffee at a local cafe on a rainy afternoon.,2
Leila,Eleni,78,Just right,yes,"The interaction with Eleni was pleasant and engaging. We shared a mutual appreciation for rainy days and cooking, which created a warm and cozy atmosphere. Eleni seemed sincere and intelligent, and our conversation flowed naturally. There were no major red flags, and I appreciated her creativity and openness to experimenting with recipes. While her ambition seemed moderate, our shared interests in cooking and enjoying rainy days made the interaction enjoyable. Overall, I felt a connection and would be interested in meeting again to explore our compatibility further.",65,75,70,80,90,85,68,60,75,65,70,85,80,yes,"['Shared interest in cooking and rainy day activities', 'Cultural connection through food', 'Lack of deep emotional topics', 'Polite and respectful interaction', 'Desire to meet again']","Leila and Eleni's conversation was polite and pleasant, with both parties expressing shared enjoyment of rainy days and cooking. They demonstrated a natural flow in conversation, showing genuine interest in each other's hobbies and cultural backgrounds. However, the interaction remained surface-level, focusing primarily on shared interests without delving into deeper emotional topics or personal values. While they both expressed a desire to meet again, the conversation lacked any significant depth or unique connection that would suggest a strong emotional bond.",You are meeting for a casual coffee at a local cafe on a rainy afternoon.,2
Leila,Ethan,75,Just right,yes,"The interaction with Ethan was pleasant and engaging. We shared a mutual appreciation for cozy cafes and tea, which made the conversation flow naturally. Ethan seemed sincere and intelligent, and I appreciated his relaxed demeanor. While there wasn't an overwhelming spark, there was a comfortable connection and potential for future interactions. Overall, it was a good match with shared interests, making it worth considering meeting again.",65,70,70,75,80,80,55,55,60,50,65,60,70,no,"['Shared interest in cafes and teas', 'Polite and friendly conversation', 'Lack of emotional depth', 'No exploration of personal values', 'Conversation was safe but unremarkable']","Leila and Ethan's conversation was polite and pleasant, but lacked depth and emotional connection. They shared a common interest in cafes and teas, which provided a safe topic for discussion. However, the interaction remained superficial, with no significant exploration of personal values or deeper topics. Both participants seemed content with the conversation, but there was no strong indication of chemistry or a compelling reason to meet again. The conversation flowed naturally, but this was more due to the safe and non-controversial topics rather than any genuine connection. Overall, the interaction was friendly but unremarkable.",You are meeting for a casual coffee at a local cafe on a rainy afternoon.,2
Leila,Jinara,78,Just right,yes,"The interaction with Jinara was pleasant and engaging. We shared a mutual appreciation for cozy cafes and a love for trying new drinks, which made the conversation flow naturally. Jinara seemed sincere and intelligent, and there was a good level of shared interests, particularly in enjoying relaxing environments. While there wasn't an overwhelming spark, the conversation was enjoyable, and I felt a genuine connection. I would be interested in meeting again to explore more common interests and see if there's further potential.",65,75,70,80,80,85,58,50,65,55,60,60,70,no,"['Shared interest in cafes and beverages', 'Smooth conversation flow', 'Lack of emotional depth', 'Superficial interaction', 'No significant shared goals or values']","Leila and Jinara's conversation is pleasant but lacks depth. They share a common interest in cozy cafes and beverages, which provides a comfortable foundation for their interaction. However, the discussion remains superficial, focusing mainly on coffee preferences and cafe atmospheres without delving into more personal or meaningful topics. There is a polite exchange of interests, but no significant emotional connection or unique shared values are evident. The conversation flows smoothly, indicating a basic level of compatibility, but there is no indication of a strong bond or potential for a deeper relationship. Both seem agreeable and open to new experiences, yet the interaction does not reveal any profound compatibility or shared goals.",You are meeting for a casual coffee at a local cafe on a rainy afternoon.,2
Leila,Jinaya,78,Just right,yes,"The interaction with Jinaya was pleasant and engaging. We shared a mutual appreciation for food and cultural experiences, which made the conversation enjoyable. Jinaya seemed sincere and intelligent, and there was a good level of shared interests, particularly in food and cultural backgrounds. While there wasn't an overwhelming spark, the conversation flowed naturally, and there were no red flags. I felt comfortable and interested in exploring the potential for a friendship or further connection. Overall, it was a positive experience, and I would like to meet Jinaya again to see where things might lead.",65,75,70,80,80,85,58,50,70,60,65,55,75,no,"['Polite and courteous interaction', 'Shared interest in food and cultural experiences', 'Lack of deep emotional connection', 'Surface-level conversation', 'Mutual interest in meeting again, but lacking enthusiasm']","Leila and Jinaya's conversation was pleasant but lacked depth and emotional connection. They both shared a polite interest in each other's backgrounds and cultural experiences, but the interaction remained surface-level. While they expressed mutual enjoyment of certain foods and environments, there was no significant exploration of deeper values or personal insights. The conversation flowed naturally, but it was more of a polite exchange than a meaningful dialogue. Both parties were courteous and expressed interest in meeting again, but this seemed more out of social obligation than genuine excitement. The interaction was devoid of any red flags, but also lacked any standout moments that would suggest a strong compatibility.",You are meeting for a casual coffee at a local cafe on a rainy afternoon.,2
Leila,Jinhee,78,Just right,yes,"The interaction with Jinhee was pleasant and engaging. We shared a cozy moment in the café, which set a nice atmosphere for our conversation. Jinhee's sincerity and intelligence stood out, and we found common ground in our appreciation for music and relaxing activities. While there wasn't an overwhelming spark, there was a comfortable connection that suggests potential for future meetings. The conversation length felt just right, allowing us to get to know each other without feeling rushed or prolonged. Overall, I felt a genuine interest in seeing Jinhee again to explore our shared interests further.",65,75,70,80,80,85,65,55,70,60,65,70,75,yes,"['Both enjoy cozy cafes and warm drinks, indicating a shared appreciation for comfort.', 'Common interest in music, though at different levels of engagement.', 'Lack of deep emotional connection or discussion of core values.', 'Natural conversation flow, suggesting basic compatibility.', 'Interest in meeting again, showing openness to further exploration.']","Leila and Jinhee's conversation was pleasant but lacked depth. They shared a mutual appreciation for cozy environments and drinks, which is a positive start. However, the interaction was somewhat superficial, focusing on light topics like favorite cafes and drinks. While they both enjoy music, their discussion did not delve into deeper personal values or beliefs, which are crucial for long-term compatibility. The conversation flowed naturally, indicating a basic level of comfort, but there was no significant emotional connection or shared vision for the future. They both expressed interest in meeting again, which suggests a willingness to explore the relationship further.",You are meeting for a casual coffee at a local cafe on a rainy afternoon.,2
Leila,Jinsoo,78,Just right,yes,"The interaction with Jinsoo was engaging and intellectually stimulating. We shared a mutual interest in education and technology, which made the conversation flow naturally. Jinsoo seemed sincere and ambitious, with a strong interest in AI and its potential in education, aligning with my values and interests. There were no red flags, and the conversation length felt just right. Overall, I felt a connection and would be interested in meeting again to explore these shared interests further.",80,70,75,90,88,85,68,78,70,65,80,85,75,yes,"['Shared interest in intellectual topics and rainy day activities', 'Natural conversation flow with mutual respect', 'Lack of deep emotional connection or personal sharing', 'Alignment in views on technology and education', 'Absence of any significant red flags']","Leila and Jinsoo's conversation was pleasant and flowed naturally, indicating a decent level of comfort with each other. They both expressed a shared appreciation for rainy days and intellectual pursuits, which suggests a good alignment in interests. However, the interaction lacked any deep emotional connection or personal disclosures, keeping the conversation at a surface level. While they touched on topics like AI and education, which are intellectually stimulating, there was no exploration of personal values or life goals that could indicate long-term compatibility. The conversation was polite and respectful, but it did not reveal any significant red flags or concerning behavior.",You are meeting for a casual coffee at a local cafe on a rainy afternoon.,2
Leila,Jinwoo,78,Just right,yes,"The interaction with Jinwoo was enjoyable and engaging. We shared a mutual appreciation for books and documentaries, which made the conversation flow naturally. Jinwoo seemed sincere and intelligent, and I appreciated his recommendations and insights. There was a good balance of shared interests, particularly in literature and documentaries, which made the conversation fun and intellectually stimulating. While there was no overwhelming spark, the conversation was pleasant and left room for potential future interactions. Overall, it was a positive experience with no major red flags.",70,75,80,90,85,85,65,65,70,60,80,85,75,yes,"['Shared interest in books and documentaries', 'Similar appreciation for rainy days', 'Polite and respectful conversation', 'Lack of emotional depth', 'Potential for further connection if explored']","Leila and Jinwoo's conversation is characterized by a polite and friendly tone, with both parties showing a genuine interest in each other's preferences and activities. They share a mutual appreciation for rainy days, books, and documentaries, which provides a solid foundation for their interaction. However, the conversation lacks depth and emotional connection, as it remains largely on the surface level without exploring personal insights or deeper topics. Their exchange is smooth, but it doesn't reveal much about their individual personalities or values beyond shared interests. While they do express a desire to meet again, it seems more based on politeness than a strong emotional pull.",You are meeting for a casual coffee at a local cafe on a rainy afternoon.,2
