Leila,Julian,75,Just right,yes,"The interaction with Julian was pleasant and engaging. We shared a mutual appreciation for reading and had a thoughtful discussion about books that have impacted us. Julian seemed sincere and intelligent, which I value highly. There was a good level of shared interests, particularly in our reading preferences, which made the conversation flow naturally. While there wasn't an overwhelming spark, the conversation was enjoyable, and I felt a potential for a meaningful connection. I would be interested in seeing Julian again to explore this further.",70,70,75,85,80,80,55,65,60,50,75,60,70,no,"['Shared interest in reading but different preferences', 'Polite and respectful interaction', 'Lack of emotional depth', 'No significant red flags', 'Conversation lacked excitement or spontaneity']","Leila and Julian's conversation was polite and cordial, but it lacked depth and emotional connection. While they shared a mutual interest in reading, their preferences diverged significantly, with Leila enjoying fiction and psychology, and Julian focusing on non-fiction related to history and economics. The conversation flowed naturally, but there was little evidence of a strong emotional connection or chemistry. Both participants were courteous and engaged, but their interaction felt more like an exchange of pleasantries rather than a meaningful connection. There were no red flags or concerning behaviors, but also no standout moments that indicated a strong compatibility.",You are meeting for a casual coffee at a local cafe on a rainy afternoon.,2
Leila,Kai,78,Just right,yes,"The interaction with Kai was pleasant and engaging. We shared a mutual appreciation for rainy days and a love for exploring different perspectives, whether through photography or documentaries. Kai seemed sincere and intelligent, and there was a genuine connection in our conversation. While there wasn't an overwhelming spark, the shared interests and thoughtful dialogue suggest potential for future interactions. Overall, it was a good match, and I would be interested in seeing Kai again to explore our compatibility further.",65,75,70,80,80,85,65,65,70,60,80,70,75,yes,"['Shared appreciation for rainy day activities', 'Polite and respectful interaction', 'Lack of deep emotional connection', 'Similar values in introspection and relaxation', 'No significant red flags or disagreements']","Leila and Kai's conversation was pleasant and flowed naturally, indicating a decent level of comfort between them. They both share an appreciation for rainy days and find solace in activities that allow them to slow down and reflect, such as reading, photography, cooking, and watching documentaries. This suggests a shared value in introspection and relaxation. However, while their interests overlap, the conversation lacks depth in emotional connection and doesn't explore any topics beyond surface-level hobbies. They both seem polite and interested in each other's perspectives, but there isn't a strong indication of a deeper bond forming. The interaction is cordial and friendly, but it feels more like a casual chat between acquaintances rather than a potential romantic connection. The lack of any significant disagreements or red flags is positive, but it also means there wasn't much passion or excitement in their exchange.",You are meeting for a casual coffee at a local cafe on a rainy afternoon.,2
Leila,Kiran,78,Just right,yes,"The interaction with Kiran was enjoyable and engaging. We shared a mutual appreciation for rainy days and similar interests in cooking and creativity, which made the conversation flow naturally. Kiran seemed sincere and intelligent, with a good sense of fun and ambition. There were no red flags, and the conversation length felt just right. Overall, there was a genuine connection and potential for future interactions.",78,75,70,80,82,85,65,65,70,60,80,85,75,yes,"['Shared interest in cooking and rainy day activities', 'Natural conversation flow', 'Lack of deep emotional connection', 'Surface-level discussion', 'No red flags or concerning behavior']","Leila and Kiran's conversation was pleasant and flowed naturally, indicating a decent level of comfort and mutual interest. They both share an appreciation for rainy days, books, and cooking, which suggests some common ground. However, the interaction lacked depth and emotional connection, with both parties sticking to safe topics without exploring deeper personal values or experiences. While they discussed shared interests, such as cooking and music, the conversation remained surface-level, which might indicate a lack of deeper compatibility. There were no apparent red flags, but also no strong emotional connection or chemistry evident in the conversation.",You are meeting for a casual coffee at a local cafe on a rainy afternoon.,2
Leila,Leyla,78,Just right,yes,"The interaction with Leyla was engaging and insightful. We shared a mutual interest in exploring different cultures and had a meaningful conversation about our favorite places. Leyla seemed sincere and intelligent, and I appreciated her ambition and enthusiasm for her research. The conversation felt natural and flowed well, making it enjoyable. There were no major red flags, and I felt a genuine connection, which makes me interested in seeing her again.",80,75,70,90,85,85,65,70,70,60,75,85,80,yes,"['Shared interest in cultural exploration and travel', 'Polite and natural conversation flow', 'Lack of deep emotional connection', 'Common appreciation for learning and curiosity', 'No significant red flags or concerning behavior']","Leila and Leyla's conversation was polite and flowed naturally without any awkward pauses, indicating a decent level of comfort with each other. They both showed a genuine interest in cultural topics and travel, which suggests a shared curiosity about the world. However, the conversation lacked depth in terms of emotional connection and personal sharing beyond surface-level interests. While they both expressed enjoyment in the conversation, there was no significant emotional engagement or vulnerability that would suggest a deeper connection. The interaction remained friendly and cordial, but it did not reveal any strong personal compatibility or chemistry.",You are meeting for a casual coffee at a local cafe on a rainy afternoon.,2
Leila,Lianhua,78,Just right,yes,"The interaction with Lianhua was enjoyable and engaging. We shared a lot of common interests, particularly in literature and TV shows, which made the conversation flow naturally. Lianhua seemed sincere and intelligent, and I appreciated the depth of our discussion on human nature and relationships. While there wasn't an overwhelming spark, there was a genuine connection and potential for a deeper friendship. The conversation length was just right, allowing us to explore various topics without feeling rushed. Overall, it was a positive experience, and I would be interested in meeting Lianhua again to further explore our shared interests.",65,75,70,80,90,85,72,N/A,N/A,70,80,75,85,yes,"['Shared interest in literature and thought-provoking media', 'Natural and comfortable conversation flow', 'Lack of discussion on personal values or future goals', 'Both enjoy introspective and reflective activities', 'Potential for deeper connection if more personal topics are explored']","Leila and Lianhua's conversation was pleasant and flowed naturally, indicating a good level of comfort between them. They both share a fondness for rainy days and have overlapping interests in literature and television, particularly enjoying Haruki Murakami's works and shows that provoke thought. However, the interaction lacked depth in terms of exploring personal values or future aspirations, which are crucial for assessing long-term compatibility. While they both enjoy introspective and thought-provoking content, the conversation remained on a surface level without delving into more personal or challenging topics that could reveal deeper compatibility or potential conflicts.",You are meeting for a casual coffee at a local cafe on a rainy afternoon.,2
Leila,Lucia,78,Just right,yes,"The conversation with Lucia was engaging and enjoyable. We shared a mutual appreciation for rainy days and discussed interesting topics like documentaries and tech trends. Lucia seemed sincere and intelligent, and we had several shared interests, particularly in technology and its impact on society. The interaction felt genuine, and there were no red flags. I felt a good connection and potential for further conversations.",80,75,70,90,85,85,65,70,70,65,80,75,75,yes,"['Shared interest in technology and documentaries', 'Comfortable and natural conversation flow', 'Lack of deep emotional connection', 'Common appreciation for rainy day activities', 'Potential for friendship over romance']","Leila and Lucia's conversation was polite and flowed naturally, suggesting a reasonable level of comfort between them. They both showed an appreciation for rainy days and shared interests in technology and documentaries, which indicates some common ground. However, the interaction lacked depth in emotional connection, as they primarily discussed surface-level topics. While they touched on tech and cultural interests, there was no significant exploration of personal values or deeper emotional topics. This could suggest a potential for friendship rather than a strong romantic connection. Both seemed genuinely interested in each other's hobbies and ideas, but the conversation did not reveal any profound emotional bond or shared life goals.",You are meeting for a casual coffee at a local cafe on a rainy afternoon.,2
Leila,Marcus,78,Just right,yes,"The interaction with Marcus was engaging and intellectually stimulating. We shared a mutual interest in documentaries and philosophical discussions, which made the conversation flow naturally. Marcus seemed sincere and intelligent, and I appreciated his reflective nature. There was a genuine connection, especially when discussing our thoughts on the universe and human psychology. While there wasn't an overwhelming romantic spark, the shared interests and meaningful conversation make me interested in seeing him again. Overall, it was a positive experience with potential for further connection.",80,70,75,90,88,85,75,60,70,65,85,90,80,yes,"['Shared interest in documentaries and intellectual topics', 'Natural conversation flow', 'Lack of exploration into personal values and life goals', 'Mutual appreciation for reflection and connection', 'Absence of red flags or concerning behavior']","The conversation between Leila and Marcus was pleasant and flowed naturally. Both participants showed genuine interest in each other's thoughts and experiences, particularly regarding their shared interest in documentaries. They both expressed a reflective nature and a curiosity about the world, which is a strong point of connection. However, the interaction was somewhat surface-level, focusing primarily on shared interests without delving deeply into personal values or life goals. While the conversation was enjoyable, it lacked depth in exploring potential differences or challenges they might face. There were no apparent red flags, but also no indication of a strong emotional connection beyond shared interests.",You are meeting for a casual coffee at a local cafe on a rainy afternoon.,2
Leila,Marek,78,Just right,yes,"The interaction with Marek was engaging and intellectually stimulating. We shared a mutual appreciation for documentaries and philosophical discussions, which made the conversation flow naturally. Marek's sincerity and intelligence were particularly appealing, and there was a noticeable alignment in our interests, especially in topics like technology and culture. While the conversation was more on the serious side, it was enjoyable and left room for deeper exploration in future meetings. Overall, it was a positive experience with potential for further connection.",80,75,70,90,85,85,68,70,Not directly assessable from the conversation,65,85,80,75,yes,"['Shared interest in intellectual topics and media', 'Natural conversation flow', 'Lack of emotional depth', 'No discussion of personal values or future goals', 'Enjoyment of rainy day activities']","Leila and Marek's conversation demonstrates a pleasant exchange with shared interests in documentaries, books, and the calming nature of rainy days. Their interaction seems natural, with both participants engaging in a balanced dialogue. However, the conversation lacks depth in emotional connection and personal sharing beyond intellectual topics. While they share interests in media and cultural exploration, there is no indication of deeper personal values or life goals being discussed, which could be essential for long-term compatibility.",You are meeting for a casual coffee at a local cafe on a rainy afternoon.,2
Leila,Mei Ling,75,Just right,yes,"The interaction with Mei Ling was engaging and intellectually stimulating. We shared interests in deep topics like philosophy and science fiction, which made the conversation enjoyable. Mei Ling seemed sincere and intelligent, with a good sense of ambition. The conversation flowed naturally, and I appreciated her insights on technology and society. There were no red flags, and the connection felt genuine, making me interested in seeing her again.",80,70,75,90,80,85,65,65,70,60,75,55,80,yes,"['Shared interest in reading and cafes', 'Divergent literary preferences', 'Natural conversation flow', 'Lack of deep emotional connection', 'No red flags or concerning behaviors']","Leila and Mei Ling's conversation was pleasant and flowed naturally, indicating a good initial rapport. Both participants showed genuine interest in each other's preferences and shared some common interests, such as reading and enjoying cafes. However, their interests diverged significantly in terms of literary preferences, with Leila leaning towards philosophy and Mei Ling towards science fiction. This difference could either enrich their interactions or create a disconnect if not appreciated by both parties. The conversation lacked depth in emotional connection and was more focused on surface-level topics, which is typical for a first meeting but does not strongly indicate long-term compatibility. There were no apparent red flags or concerning behaviors, but the interaction was also not particularly exceptional.",You are meeting for a casual coffee at a local cafe on a rainy afternoon.,2
Leila,Meilin,78,Just right,yes,"The interaction with Meilin was engaging and enjoyable. We shared a mutual appreciation for rainy days and had a lot in common, especially in our interests in neuroscience and documentaries. Meilin seemed very sincere and intelligent, which I found appealing. The conversation flowed naturally, and I felt a genuine connection. There were no red flags, and I appreciated Meilin's enthusiasm for similar topics. Overall, it was a positive experience, and I would be interested in meeting again to explore our shared interests further.",80,70,75,90,88,85,75,80,70,60,90,85,85,yes,"['Shared interest in books and documentaries', 'Natural and smooth conversation flow', 'Lack of deep emotional connection', 'Common appreciation for rainy days', 'Intellectual curiosity and ambition']","Leila and Meilin's interaction was pleasant and engaging, with a natural flow to their conversation. They both expressed a shared appreciation for rainy days and similar interests in books and documentaries. However, while their conversation was intellectually stimulating, it lacked a deeper emotional connection or any significant personal revelations. Both participants were polite and showed genuine interest in each other's hobbies, but there was no indication of a strong emotional bond forming. The conversation was safe and somewhat predictable, focusing on common interests rather than exploring deeper personal topics.",You are meeting for a casual coffee at a local cafe on a rainy afternoon.,2
Leila,Mingxia,78,Just right,yes,"The conversation with Mingxia was pleasant and engaging. We shared a lot of common interests, especially in cooking and enjoying rainy days, which made the interaction feel natural and comfortable. Mingxia seemed sincere and intelligent, and I appreciated her calm demeanor. While there wasn't an overwhelming spark, there was enough of a connection to warrant another meeting. I felt that there was potential for a deeper friendship or relationship, and I would be interested in exploring that further.",65,75,70,80,90,85,68,55,70,60,65,80,75,yes,"['Shared interest in cooking and rainy day activities', 'Natural conversation flow', 'Lack of deep emotional connection', 'Superficial interaction without personal disclosure', 'Potential for further exploration of shared interests']","Leila and Mingxia's conversation reveals a pleasant but somewhat superficial interaction. They both share an appreciation for rainy days and cooking, which provides a solid foundation for shared interests. However, the conversation lacks depth in terms of emotional connection and personal disclosure. Both parties are polite and engage in small talk, but there is no indication of a strong emotional bond or deeper understanding of each other's personalities. The conversation flows naturally, indicating a good initial rapport, but it remains surface-level without exploring more personal or meaningful topics. Overall, while they have compatible interests, the interaction does not suggest an exceptional match.",You are meeting for a casual coffee at a local cafe on a rainy afternoon.,2
Leila,Minji,78,Just right,yes,"The interaction with Minji was pleasant and engaging. We shared a mutual appreciation for rainy days and comfort foods, which made the conversation feel warm and genuine. Minji seemed sincere and intelligent, and we had a good level of shared interests, particularly in cooking and enjoying cozy activities. While the conversation was mostly polite, there was a potential for deeper connection, especially given our shared values and interests. Overall, it was a good match, and I would be interested in meeting Minji again to explore our compatibility further.",65,75,70,80,90,85,68,50,70,60,65,80,75,yes,"['Shared enjoyment of rainy days and cozy activities', 'Natural conversation flow without awkward pauses', 'Surface-level interaction with limited depth', 'Potential cultural connection through food', 'Lack of discussion on deeper values or ambitions']","Leila and Minji's conversation is pleasant and flows naturally, indicating a good initial rapport. They share a mutual appreciation for rainy days and comfort activities like cooking and reading, which suggests some alignment in lifestyle preferences. However, the conversation remains surface-level, focusing on shared interests without delving deeper into personal values or life goals. While they both express enjoyment and a desire to meet again, the interaction lacks depth and exploration of potential differences that could impact long-term compatibility.",You are meeting for a casual coffee at a local cafe on a rainy afternoon.,2
Leila,Niran,72,Just right,yes,"The interaction with Niran was pleasant and engaging. We both appreciated the cozy atmosphere of the cafe and shared a mutual interest in relaxing activities, like reading and gaming. Niran seemed sincere and intelligent, with a good sense of fun. While we didn't have a lot of shared interests, the conversation flowed naturally, and there was potential for a deeper connection. Overall, it was a good match, and I would be interested in seeing Niran again to explore our compatibility further.",68,65,70,75,60,80,55,60,60,50,65,40,70,no,"['Polite and respectful interaction', 'Different hobbies and interests', 'Lack of deep emotional connection', 'Smooth conversation flow', 'Limited shared activities']","Leila and Niran's conversation at the cafe was polite and pleasant, but it lacked depth and strong emotional connection. While they both appreciated the cozy atmosphere of the cafe, their interests diverged significantly. Leila enjoys reading philosophical and psychological books, while Niran is more inclined towards gaming and tech-related content. Their conversation was smooth, but it didn't reveal any profound shared values or passions. Leila's interest in reading and Niran's gaming hobby didn't intersect, suggesting limited shared activities. The conversation ended on a positive note, but it felt more like a polite exchange than a genuine connection.",You are meeting for a casual coffee at a local cafe on a rainy afternoon.,2
Leila,Rafael,75,Just right,yes,"The interaction with Rafael was pleasant and engaging. We both enjoyed the soothing ambiance of the rainy afternoon, which set a comfortable tone for our conversation. Rafael seemed sincere and intelligent, sharing an interest in reading and discussing thought-provoking topics, which aligns with my interests. Although we didn't have many shared hobbies, his passion for surfing and my interest in trying new experiences suggest potential for future activities together. Overall, the conversation felt natural and enjoyable, with no major red flags, making me interested in seeing him again.",70,70,75,85,65,80,58,55,70,60,65,50,75,no,"['Both enjoy reading but have different preferences in genres.', 'Shared appreciation for cozy environments and rain.', 'Divergent hobbies: cooking vs. surfing.', 'Natural conversation flow without awkward pauses.', 'Lack of strong emotional connection or shared values.']","Leila and Rafael's conversation was pleasant but lacked depth in terms of emotional connection and shared values. They both enjoy the rain and have a mutual appreciation for cozy environments, which sets a nice tone for their interaction. However, their interests diverge significantly. Leila is into philosophy and cooking, while Rafael is passionate about surfing and enjoys Oliver Sacks' work. Although they both like reading, their literary tastes seem to differ. The conversation flowed naturally, and there were no apparent red flags, but the lack of a deeper connection or shared values might hinder their compatibility in the long run.",You are meeting for a casual coffee at a local cafe on a rainy afternoon.,2
Leila,Riya,78,Just right,yes,"The interaction with Riya was pleasant and engaging. We shared a mutual interest in exploring new flavors and cuisines, which made the conversation flow naturally. Riya seemed sincere and intelligent, and I appreciated her openness about her background and experiences. While there wasn't an overwhelming spark, there was a comfortable connection that suggests potential for further friendship. The conversation length felt just right, allowing us to cover various topics without feeling rushed. Overall, it was a good match with room for deeper connection in future meetings.",65,75,70,80,80,85,65,50,70,60,65,80,75,yes,"['Shared interest in trying new foods', 'Smooth conversation flow', 'Lack of deeper emotional connection', 'Surface-level interaction', 'Common background of exploring different cultures']","Leila and Riya's conversation was pleasant but lacked depth. They connected over shared interests in trying new foods and flavors, which is a positive sign. However, the conversation remained surface-level, focusing primarily on food and weather. There was little exploration of deeper topics or personal values, which are crucial for assessing long-term compatibility. Both seemed polite and engaged, but there was no indication of a strong emotional connection or unique chemistry. The interaction was smooth but didn't reveal much about their personalities or compatibility beyond shared culinary interests.",You are meeting for a casual coffee at a local cafe on a rainy afternoon.,2
Leila,Sakura,78,Just right,yes,"The interaction with Sakura was enjoyable and engaging. We shared a strong interest in books and storytelling, which provided a solid foundation for our conversation. Sakura seemed sincere and intelligent, and I appreciated her enthusiasm for discussing literature. The conversation flowed naturally, and there were no red flags or awkward moments. While I didn't feel a strong romantic attraction, the shared interests and genuine connection suggest potential for a meaningful friendship. Overall, it was a pleasant experience, and I would be interested in meeting Sakura again to explore our shared interests further.",65,70,75,80,90,85,68,55,70,60,65,70,75,yes,"['Shared interest in books and art', 'Comfortable and natural conversation flow', 'Different reading preferences', 'Lack of emotional depth in conversation', 'No red flags or concerning behavior']","The conversation between Leila and Sakura is pleasant and flows naturally, indicating a good level of comfort and ease between them. They both share a love for books and have a mutual appreciation for art and cozy environments, which suggests a decent overlap in interests. However, while they enjoy similar activities, their preferences in reading genres differ, with Leila leaning towards philosophy and psychology, and Sakura towards sci-fi and fantasy. This difference might limit deeper intellectual connection unless they are open to exploring each other's interests further. The conversation lacks any significant emotional depth or vulnerability, which could be necessary for a stronger bond. There are no evident red flags or concerning behaviors, but the interaction remains largely surface-level.",You are meeting for a casual coffee at a local cafe on a rainy afternoon.,2
